start	end	text
2438120	2439960	That is the crux of the ontology.
2440720	2443440	Homeerheadic as opposed to homeostatic.
2443580	2445140	Let's define the mechanical difference.
2445180	2445560	Please do.
2445940	2450680	Homeostasis is the tendency of a system to return to a fixed static point.
2450680	2452780	Think of a thermostat in your house.
2453040	2455840	It detects, the temperature is 72 degrees, it turns off.
2455900	2457440	It detects 70 degrees, it turns on.
2457480	2459620	It just constantly bounces back to a dead center.
2459840	2460640	And homeerheadicis.
2461080	2463720	Homeerheadicis is the maintenance of a dynamic trajectory.
2463960	2465920	It is a continuous, messy flow.
2466160	2467380	Think of riding a bicycle.
2467700	2467940	Okay.
2468060	2469820	You are never perfectly balanced on a bicycle.
2470160	2474220	You are constantly falling slightly to the left, correcting, falling slightly to the right, correcting.
2474420	2480160	The stability comes from the forward motion and the continuous cycle of sensory feedback and muscular correction.
2480680	2483760	You are navigating the constraints of gravity to sustain momentum.
2484060	2485200	That is a perfect metaphor.
2486100	2489640	Survival isn't about standing perfectly still in an optimized balance.
2489840	2492360	It's about constantly falling and catching yourself.
2492460	2492920	Exactly.
2493100	2496380	It's sustaining continuous, messy flows of self-repair.
2496500	2498000	We parse the world.
2498380	2499940	We rewrite our internal rules.
2500380	2503000	We fix our hallucinations by crashing into reality.
2503600	2504760	And we keep crawling forward.
2505220	2507480	That is the essence of the process ontology.
2507740	2510260	To exist intelligently is to yarn crawl.
2510260	2510740	Wow.
2511260	2514400	We have covered an absolute mountain of theory today.
2514720	2516500	Let's do a quick distillation of this journey.
2516800	2519660	We started by dismantling the idea of exhaustive search.
2520260	2522540	Intelligence isn't about analyzing infinity.
2522960	2528480	It's about navigating the narrow, admissible paths dictated by physical and historical constraints.
2528480	2534860	And because our metabolic budgets force us to navigate constrained paths, we have to compress the reality we see.
2535340	2539340	That extreme compression means hallucinating the missing pieces is our default state.
2539560	2546100	But as long as those hallucinations remain corrigible, as long as we welcome the friction of reality to correct our models, we survive.
2546100	2554040	We then looked at the terrifying rise of opaque AI, recognizing it not as an alien replacement, but as a cognitive prosthetic.
2554540	2557740	But we must demand inferential continuity from our tools.
2558220	2562440	We need to see the math, the boot sequence, not just the polished synthetic fluency.
2562440	2565920	Because if we don't demand provenance, we fall into the trap of proxy drift.
2566520	2569820	We optimize for flattened metrics like engagement or citations.
2570460	2575480	And that blind optimization pressure destroys the complex reality we were trying to measure in the first place.
2575480	2578360	And the antidote to all of this is the yarn crawler.
2578920	2584860	Acting locally, logging our semantic trails, building cognitive geometry that makes our dependencies visible,
2585160	2588300	and embracing the continuous, messy act of self-repair.
2588960	2595020	If you are listening to this right now, I want you to think about how this framework can immediately alter how you view your daily life.
2595680	2598700	Look at the metrics you are chasing at work or in your personal life.
2599120	2600520	Are you optimizing a proxy?
2600860	2602340	It's a hard question to ask yourself.
2602680	2603420	It really is.
2603420	2606580	Are you just trying to hit a KPI on a spreadsheet?
2607000	2611360	Or are you grounded in the messy, uncompressed reality of what you actually produce?
2612380	2617340	When you interact with a new AI tool, are you being seduced by its synthetic fluency?
2617660	2620260	Or are you aggressively testing its inferential logic?
2620880	2623800	Are you letting a drifting hallucination replace your reality?
2624040	2629740	It demands a much more active, combative, and participating relationship with the world and the tools we build.
2629740	2636840	But before we wrap up, I promise to drop one final, highly speculative nugget from the text that we haven't touched on yet.
2636900	2637420	Oh, right.
2637640	2639240	A speculation to end all speculations.
2639480	2643700	It's buried in the final chapter, heavily tagged with S for speculative extrapolation.
2644040	2646680	It's the RSVP cosmological framework.
2647040	2647780	Walk me through this.
2647780	2658280	At the very edge of the monograph, Flishin briefly conjectures that these exact same rules, constraints, admissibility, compression, and fields apply to the actual persistence of physical matter in the universe.
2658440	2658640	Okay.
2658720	2660280	The RSVP stands for what again?
2660940	2662860	Relativistic Scalar Vector Plenum.
2662860	2670760	The text proposes that the entire cosmos isn't just a static block of space-time governed by immutable, unthinking laws.
2671020	2675800	It conjectures that the physical universe itself is the ultimate yarn crawler.
2676040	2676600	Wait.
2677060	2683420	Meaning the universe, at a quantum or cosmological level, is doing exactly what the squirrel is doing in the forest.
2683640	2686180	What our brains are doing when we reconstruct a memory.
2686180	2687260	Mechanically, yes.
2687660	2702920	It suggests that physical matter and cosmological structure are formed by the universe constantly collapsing infinite quantum possibilities into concrete reality, navigating its own thermodynamic constraints, and continuously repairing its own geometry to persist over time.
2703340	2704980	The universe is self-refactoring.
2705120	2707220	So we go all the way back to the opening hook.
2707300	2713580	The underlying physics of the cosmos, the biological memory firing in our neurons, and the computational architecture of our AI.
2713580	2719400	They really might just be overlapping coordinate charts of the exact same cognitive geometry, leaving you to ponder.
2719620	2719820	Yeah.
2719980	2723020	What if the universe itself is thinking exactly the same way you are?
2723060	2726780	A profoundly beautiful, if dizzying, thought to end on.
2727020	2730280	We'll leave you to navigate the constraints of that idea on your own.
2730740	2732320	Thanks for taking the deep dive with us.
